{
  "$schema": "https://json-schema.org/draft/2020-12/schema",
  "$id": "smarthive/contracts/event.schema.json",
  "title": "Event",
  "description": "Detection event or node-side alarm (node to server)",
  "type": "object",
  "properties": {
    "schema": {
      "type": "string",
      "pattern": "^smarthive\\.event/1\\.[0-9]+$"
    },
    "msg_id": {
      "type": "string",
      "pattern": "^[0-9a-f]{8}-[0-9a-f]{4}-[0-9a-f]{4}-[0-9a-f]{4}-[0-9a-f]{12}$"
    },
    "node_id": {
      "type": "string",
      "minLength": 1
    },
    "boot_id": {
      "type": "string",
      "pattern": "^[0-9a-f]{8}-[0-9a-f]{4}-[0-9a-f]{4}-[0-9a-f]{4}-[0-9a-f]{12}$"
    },
    "sent_at": {
      "type": "string",
      "pattern": "^\\d{4}-\\d{2}-\\d{2}T\\d{2}:\\d{2}:\\d{2}(\\.\\d+)?Z$"
    },
    "event": {
      "type": "object",
      "required": [
        "type",
        "clock_synced"
      ],
      "properties": {
        "type": {
          "enum": [
            "threat_detected",
            "varroa_high",
            "sensor_fault",
            "storage_low",
            "dropped_data"
          ]
        },
        "episode_id": {
          "type": "string",
          "pattern": "^[0-9a-f]{8}-[0-9a-f]{4}-[0-9a-f]{4}-[0-9a-f]{4}-[0-9a-f]{12}$"
        },
        "cls": {
          "type": "string"
        },
        "first_seen": {
          "type": "string",
          "pattern": "^\\d{4}-\\d{2}-\\d{2}T\\d{2}:\\d{2}:\\d{2}(\\.\\d+)?Z$"
        },
        "last_seen": {
          "type": "string",
          "pattern": "^\\d{4}-\\d{2}-\\d{2}T\\d{2}:\\d{2}:\\d{2}(\\.\\d+)?Z$"
        },
        "clock_synced": {
          "type": "boolean"
        },
        "max_conf": {
          "type": "number",
          "minimum": 0,
          "maximum": 1
        },
        "frames_positive": {
          "type": "integer",
          "minimum": 0
        },
        "frames_window": {
          "type": "integer",
          "minimum": 1
        },
        "image_id": {
          "type": "string",
          "pattern": "^[0-9a-f]{8}-[0-9a-f]{4}-[0-9a-f]{4}-[0-9a-f]{4}-[0-9a-f]{12}$"
        },
        "models": {
          "type": "object",
          "additionalProperties": {
            "type": "string"
          }
        }
      },
      "if": {
        "properties": {
          "type": {
            "const": "threat_detected"
          }
        }
      },
      "then": {
        "required": [
          "episode_id",
          "cls",
          "first_seen",
          "last_seen",
          "max_conf",
          "frames_positive",
          "frames_window"
        ]
      }
    }
  },
  "required": [
    "schema",
    "msg_id",
    "node_id",
    "boot_id",
    "sent_at",
    "event"
  ]
}
