{
  "schema": "smarthive.event/1.0",
  "msg_id": "0190f5a3-1b2c-7d4e-8f50-a1b2c3d4e5f6",
  "node_id": "node-0001",
  "boot_id": "6c1f0b0e-3a52-4d0b-9f4c-1a2b3c4d5e6f",
  "sent_at": "2026-10-06T14:03:30.000Z",
  "event": {
    "type": "threat_detected",
    "episode_id": "0190f5a2-6a00-7c10-8e2b-1d2f3a4b5c6d",
    "cls": "hornet",
    "first_seen": "2026-10-06T14:03:02.004Z",
    "last_seen": "2026-10-06T14:03:21.412Z",
    "clock_synced": true,
    "max_conf": 0.81,
    "frames_positive": 4,
    "frames_window": 10,
    "image_id": "0190f5a2-7c1e-7d43-9a1b-2f6c8e0d4b12",
    "models": {"stage1": "yolo11n-320-int8@1.0.0", "stage2": "mnv3s-128-int8@1.0.0"}
  }
}
