{
  "schema": "smarthive.event/1.0",
  "msg_id": "0190f5a2-7c1e-7d43-9a1b-2f6c8e0d4b02",
  "node_id": "node-0001",
  "boot_id": "6c1f0b0e-3a52-4d0b-9f4c-1a2b3c4d5e6f",
  "sent_at": "2026-10-06T14:05:00.000Z",
  "event": {
    "type": "threat_detected",
    "episode_id": "0190f5a2-7c1e-7d43-9a1b-2f6c8e0d4b03",
    "cls": "hornet",
    "first_seen": "2026-10-06T14:03:02.004Z",
    "last_seen": "2026-10-06T14:03:21.412Z",
    "clock_synced": true,
    "max_conf": 0.81,
    "frames_positive": 4,
    "frames_window": 10,
    "image_id": "0190f5a2-7c1e-7d43-9a1b-2f6c8e0d4b04",
    "models": {
      "stage1": "yolo11n-320-int8@1.0.0",
      "stage2": "mnv3s-128-int8@1.0.0"
    }
  }
}
